[
  {
    "schema_version": "0.2.0",
    "contract_id": "add_man_ambiguous",
    "instruction": "Add a man.",
    "topology": "insert_entity",
    "operation": "add",
    "target": {
      "kind": "entity",
      "name": "new man",
      "entity_type": "person",
      "instance_ref": "new_person",
      "count": {
        "value": 1,
        "quantifier": "exact",
        "exact": true
      },
      "existing": false
    },
    "referring_constraints": [],
    "required_relations": [],
    "forbidden_outcomes": [
      "add more than one person",
      "change an existing person",
      "invent unsupported age, hair, or pose requirements"
    ],
    "invariants": [
      {
        "subject": "existing scene",
        "property": "all unrelated entities and layout",
        "tolerance": "strict"
      }
    ],
    "region_roles": {
      "target": [
        {
          "description": "new man",
          "entity_ref": "new_person",
          "mask_status": "pending"
        }
      ],
      "dependent": [
        {
          "description": "contact shadow and local occlusion",
          "mask_status": "pending"
        }
      ],
      "context": [
        {
          "description": "available space, perspective, lighting, and source style",
          "mask_status": "not_requested"
        }
      ],
      "protected": [
        {
          "description": "all existing people and background outside insertion footprint",
          "mask_status": "pending"
        }
      ]
    },
    "ambiguities": [
      {
        "field": "appearance and placement",
        "status": "unresolved",
        "confidence": 0.2,
        "description": "The instruction specifies neither appearance nor placement.",
        "assumption": null
      }
    ],
    "clarification": {
      "needed": true,
      "questions": [
        "Where should the man be placed, and should any appearance attributes be specified?"
      ]
    },
    "provenance": [
      {
        "claim": "add exactly one man",
        "source": "instruction",
        "evidence": "singular noun: a man"
      },
      {
        "claim": "preserve unrelated content",
        "source": "annotation_rule",
        "evidence": "minimal-change principle"
      }
    ],
    "edit_scope": "local"
  },
  {
    "schema_version": "0.2.0",
    "contract_id": "add_man_user_selected_location",
    "instruction": "Add a man.",
    "topology": "insert_entity",
    "operation": "add",
    "target": {
      "kind": "entity",
      "name": "new man",
      "entity_type": "person",
      "instance_ref": "new_person",
      "count": {
        "value": 1,
        "quantifier": "exact",
        "exact": true
      },
      "existing": false
    },
    "referring_constraints": [
      {
        "field": "placement",
        "value": "user-selected empty region",
        "source": "user_input",
        "scope": "placement"
      }
    ],
    "required_relations": [
      {
        "subject": "new_person",
        "predicate": "stands_on",
        "object": "ground_plane",
        "required": true
      }
    ],
    "forbidden_outcomes": [
      "back-facing pose unless requested",
      "unsupported age or baldness",
      "replacement of an existing person"
    ],
    "invariants": [
      {
        "subject": "existing scene",
        "property": "identity and composition",
        "tolerance": "strict"
      }
    ],
    "region_roles": {
      "target": [
        {
          "description": "new man in selected region",
          "entity_ref": "new_person",
          "mask_status": "provided"
        }
      ],
      "dependent": [
        {
          "description": "feet contact and cast shadow",
          "mask_status": "pending"
        }
      ],
      "context": [
        {
          "description": "ground plane, perspective, and nearby people",
          "mask_status": "not_requested"
        }
      ],
      "protected": [
        {
          "description": "existing entities outside selected region",
          "mask_status": "pending"
        }
      ]
    },
    "ambiguities": [
      {
        "field": "appearance",
        "status": "unresolved",
        "confidence": 0.3,
        "description": "Appearance remains underspecified.",
        "assumption": null
      }
    ],
    "clarification": {
      "needed": true,
      "questions": [
        "Should appearance be left source-consistent or explicitly described?"
      ]
    },
    "provenance": [
      {
        "claim": "placement comes from selection",
        "source": "user_input",
        "evidence": "optional selection"
      }
    ],
    "edit_scope": "local"
  },
  {
    "schema_version": "0.2.0",
    "contract_id": "add_hat_multiple_people",
    "instruction": "Add a hat.",
    "topology": "attach_entity",
    "operation": "add",
    "target": {
      "kind": "entity",
      "name": "hat",
      "entity_type": "hat",
      "instance_ref": "new_hat",
      "count": {
        "value": 1,
        "quantifier": "exact",
        "exact": true
      },
      "existing": false
    },
    "anchor": {
      "entity_type": "person",
      "instance_ref": null,
      "part": "head",
      "relation": "worn_on"
    },
    "referring_constraints": [],
    "required_relations": [
      {
        "subject": "new_hat",
        "predicate": "worn_on",
        "object": "selected_person.head",
        "required": true
      }
    ],
    "forbidden_outcomes": [
      "hat on multiple people",
      "floating hat",
      "change faces or hair beyond local occlusion"
    ],
    "invariants": [
      {
        "subject": "all people",
        "property": "identity, face, pose, and clothing",
        "tolerance": "strict"
      }
    ],
    "region_roles": {
      "target": [
        {
          "description": "one new hat",
          "entity_ref": "new_hat",
          "mask_status": "pending"
        }
      ],
      "dependent": [
        {
          "description": "selected head, hair occlusion, and local shadow",
          "mask_status": "pending"
        }
      ],
      "context": [
        {
          "description": "candidate people, head pose, lighting, and style",
          "mask_status": "not_requested"
        }
      ],
      "protected": [
        {
          "description": "unselected people and background",
          "mask_status": "pending"
        }
      ]
    },
    "ambiguities": [
      {
        "field": "anchor.instance_ref",
        "status": "unresolved",
        "confidence": 0.1,
        "description": "Several people are plausible anchors.",
        "assumption": null
      }
    ],
    "clarification": {
      "needed": true,
      "questions": [
        "Which person should wear the hat?"
      ]
    },
    "provenance": [
      {
        "claim": "exactly one hat",
        "source": "instruction",
        "evidence": "singular: a hat"
      }
    ],
    "edit_scope": "local"
  },
  {
    "schema_version": "0.2.0",
    "contract_id": "add_hat_selected_person",
    "instruction": "Add a hat to the foreground woman.",
    "topology": "attach_entity",
    "operation": "add",
    "target": {
      "kind": "entity",
      "name": "hat",
      "entity_type": "hat",
      "instance_ref": "new_hat",
      "count": {
        "value": 1,
        "quantifier": "exact",
        "exact": true
      },
      "existing": false
    },
    "anchor": {
      "entity_type": "person",
      "instance_ref": "foreground_woman",
      "part": "head",
      "relation": "worn_on"
    },
    "referring_constraints": [
      {
        "field": "person.position",
        "value": "foreground",
        "source": "instruction",
        "scope": "anchor"
      },
      {
        "field": "person.gender_presentation",
        "value": "woman",
        "source": "instruction",
        "scope": "anchor"
      }
    ],
    "required_relations": [
      {
        "subject": "new_hat",
        "predicate": "worn_on",
        "object": "foreground_woman.head",
        "required": true
      }
    ],
    "forbidden_outcomes": [
      "additional hats",
      "hat on another person",
      "face or identity change"
    ],
    "invariants": [
      {
        "subject": "foreground_woman",
        "property": "identity, face, pose, and clothing",
        "tolerance": "strict"
      }
    ],
    "region_roles": {
      "target": [
        {
          "description": "new hat",
          "entity_ref": "new_hat",
          "mask_status": "pending"
        }
      ],
      "dependent": [
        {
          "description": "hair beneath hat and hat shadow",
          "mask_status": "pending"
        }
      ],
      "context": [
        {
          "description": "head orientation and lighting",
          "mask_status": "not_requested"
        }
      ],
      "protected": [
        {
          "description": "face, body, other people, and background",
          "mask_status": "pending"
        }
      ]
    },
    "ambiguities": [],
    "clarification": {
      "needed": false,
      "questions": []
    },
    "provenance": [
      {
        "claim": "foreground woman is anchor",
        "source": "instruction",
        "evidence": "explicit referring phrase"
      }
    ],
    "edit_scope": "local"
  },
  {
    "schema_version": "0.2.0",
    "contract_id": "add_church_preserve_train",
    "instruction": "Add a church building.",
    "topology": "insert_entity",
    "operation": "add",
    "target": {
      "kind": "entity",
      "name": "church building",
      "entity_type": "building",
      "instance_ref": "new_church",
      "count": {
        "value": 1,
        "quantifier": "exact",
        "exact": true
      },
      "existing": false
    },
    "referring_constraints": [],
    "required_relations": [],
    "forbidden_outcomes": [
      "replace or occlude the train",
      "break the railway relation",
      "remove an existing building"
    ],
    "invariants": [
      {
        "subject": "train",